{
  "id": "INTENT-PROFILE-0001",
  "kind": "derived_intent_profile",
  "version": "1.0.0",
  "status": "derived_inert",
  "title": "C-to-Rust Strict Port - Lite - intent companion",
  "source_profile": {
    "id": "PROFILE-0001",
    "version": "1.0.0",
    "status": "draft",
    "selection_confirmed": true,
    "source_git_blob_sha": "797c6a211acf64dbebabc6be043b5c1828504d93"
  },
  "source_rule_ids": [
    "NOM-0001",
    "NOM-0003",
    "NOM-0004",
    "NOM-0012",
    "NOM-0014",
    "NOM-0015",
    "NOM-0016",
    "NOM-0017",
    "NOM-0018",
    "NOM-0019",
    "NOM-0020",
    "NOM-0021",
    "NOM-0022",
    "NOM-0023",
    "NOM-0024",
    "NOM-0025",
    "NOM-0026",
    "NOM-0027",
    "NOM-0028",
    "NOM-0029",
    "NOM-0030",
    "NOM-0031",
    "NOM-0032",
    "NOM-0033",
    "NOM-0044",
    "NOM-0049",
    "NOM-0050",
    "NOM-0051",
    "NOM-0053",
    "NOM-0054",
    "NOM-0062",
    "NOM-0064",
    "NOM-0065",
    "NOM-0066",
    "NOM-0067",
    "NOM-0074",
    "NOM-0075",
    "NOM-0076",
    "NOM-0111",
    "NOM-0112",
    "NOM-0113"
  ],
  "source_analysis_snapshot": "ab9b06e947284dab83fe19519be21dc1b0ad5051",
  "members": [
    {
      "id": "INTENT-0004",
      "via_rules": [
        {
          "id": "NOM-0064",
          "basis": "interpretive_objective_not_new_normative_rule"
        }
      ],
      "semantic_role": "goal",
      "atomicity": "single_intent_candidate"
    },
    {
      "id": "INTENT-0007",
      "via_rules": [
        {
          "id": "NOM-0065",
          "basis": "interpretive_objective_not_new_normative_rule"
        }
      ],
      "semantic_role": "method",
      "atomicity": "single_intent_candidate"
    },
    {
      "id": "INTENT-0019",
      "via_rules": [
        {
          "id": "NOM-0066",
          "basis": "interpretive_objective_not_new_normative_rule"
        },
        {
          "id": "NOM-0067",
          "basis": "interpretive_objective_not_new_normative_rule"
        }
      ],
      "semantic_role": "reporting",
      "atomicity": "composite_report"
    },
    {
      "id": "INTENT-0020",
      "via_rules": [
        {
          "id": "NOM-0001",
          "basis": "interpretive_objective_not_new_normative_rule"
        },
        {
          "id": "NOM-0003",
          "basis": "interpretive_objective_not_new_normative_rule"
        },
        {
          "id": "NOM-0004",
          "basis": "interpretive_objective_not_new_normative_rule"
        },
        {
          "id": "NOM-0050",
          "basis": "interpretive_objective_not_new_normative_rule"
        },
        {
          "id": "NOM-0051",
          "basis": "interpretive_objective_not_new_normative_rule"
        }
      ],
      "semantic_role": "goal",
      "atomicity": "single_intent_candidate"
    },
    {
      "id": "INTENT-0028",
      "via_rules": [
        {
          "id": "NOM-0014",
          "basis": "interpretive_objective_not_new_normative_rule"
        },
        {
          "id": "NOM-0015",
          "basis": "interpretive_objective_not_new_normative_rule"
        },
        {
          "id": "NOM-0016",
          "basis": "interpretive_objective_not_new_normative_rule"
        },
        {
          "id": "NOM-0017",
          "basis": "interpretive_objective_not_new_normative_rule"
        },
        {
          "id": "NOM-0022",
          "basis": "interpretive_objective_not_new_normative_rule"
        },
        {
          "id": "NOM-0023",
          "basis": "interpretive_objective_not_new_normative_rule"
        }
      ],
      "semantic_role": "goal",
      "atomicity": "single_intent_candidate"
    },
    {
      "id": "INTENT-0029",
      "via_rules": [
        {
          "id": "NOM-0018",
          "basis": "interpretive_objective_not_new_normative_rule"
        },
        {
          "id": "NOM-0021",
          "basis": "interpretive_objective_not_new_normative_rule"
        }
      ],
      "semantic_role": "goal",
      "atomicity": "single_intent_candidate"
    },
    {
      "id": "INTENT-0030",
      "via_rules": [
        {
          "id": "NOM-0019",
          "basis": "interpretive_objective_not_new_normative_rule"
        },
        {
          "id": "NOM-0049",
          "basis": "interpretive_objective_not_new_normative_rule"
        }
      ],
      "semantic_role": "goal",
      "atomicity": "single_intent_candidate"
    },
    {
      "id": "INTENT-0031",
      "via_rules": [
        {
          "id": "NOM-0020",
          "basis": "interpretive_objective_not_new_normative_rule"
        }
      ],
      "semantic_role": "goal",
      "atomicity": "single_intent_candidate"
    },
    {
      "id": "INTENT-0032",
      "via_rules": [
        {
          "id": "NOM-0012",
          "basis": "interpretive_objective_not_new_normative_rule"
        },
        {
          "id": "NOM-0024",
          "basis": "interpretive_objective_not_new_normative_rule"
        },
        {
          "id": "NOM-0025",
          "basis": "interpretive_objective_not_new_normative_rule"
        },
        {
          "id": "NOM-0026",
          "basis": "interpretive_objective_not_new_normative_rule"
        }
      ],
      "semantic_role": "goal",
      "atomicity": "single_intent_candidate"
    },
    {
      "id": "INTENT-0033",
      "via_rules": [
        {
          "id": "NOM-0024",
          "basis": "interpretive_objective_not_new_normative_rule"
        },
        {
          "id": "NOM-0025",
          "basis": "interpretive_objective_not_new_normative_rule"
        },
        {
          "id": "NOM-0026",
          "basis": "interpretive_objective_not_new_normative_rule"
        },
        {
          "id": "NOM-0027",
          "basis": "interpretive_objective_not_new_normative_rule"
        },
        {
          "id": "NOM-0028",
          "basis": "interpretive_objective_not_new_normative_rule"
        },
        {
          "id": "NOM-0033",
          "basis": "interpretive_objective_not_new_normative_rule"
        },
        {
          "id": "NOM-0111",
          "basis": "interpretive_objective_not_new_normative_rule"
        },
        {
          "id": "NOM-0112",
          "basis": "interpretive_objective_not_new_normative_rule"
        },
        {
          "id": "NOM-0113",
          "basis": "interpretive_objective_not_new_normative_rule"
        }
      ],
      "semantic_role": "goal",
      "atomicity": "single_intent_candidate"
    },
    {
      "id": "INTENT-0034",
      "via_rules": [
        {
          "id": "NOM-0029",
          "basis": "interpretive_objective_not_new_normative_rule"
        },
        {
          "id": "NOM-0030",
          "basis": "interpretive_objective_not_new_normative_rule"
        },
        {
          "id": "NOM-0031",
          "basis": "interpretive_objective_not_new_normative_rule"
        },
        {
          "id": "NOM-0032",
          "basis": "interpretive_objective_not_new_normative_rule"
        }
      ],
      "semantic_role": "goal",
      "atomicity": "single_intent_candidate"
    },
    {
      "id": "INTENT-0036",
      "via_rules": [
        {
          "id": "NOM-0044",
          "basis": "interpretive_objective_not_new_normative_rule"
        }
      ],
      "semantic_role": "goal",
      "atomicity": "single_intent_candidate"
    },
    {
      "id": "INTENT-0037",
      "via_rules": [
        {
          "id": "NOM-0049",
          "basis": "interpretive_objective_not_new_normative_rule"
        }
      ],
      "semantic_role": "goal",
      "atomicity": "single_intent_candidate"
    },
    {
      "id": "INTENT-0038",
      "via_rules": [
        {
          "id": "NOM-0053",
          "basis": "interpretive_objective_not_new_normative_rule"
        }
      ],
      "semantic_role": "goal",
      "atomicity": "single_intent_candidate"
    },
    {
      "id": "INTENT-0039",
      "via_rules": [
        {
          "id": "NOM-0054",
          "basis": "interpretive_objective_not_new_normative_rule"
        }
      ],
      "semantic_role": "goal",
      "atomicity": "single_intent_candidate"
    },
    {
      "id": "INTENT-0041",
      "via_rules": [
        {
          "id": "NOM-0062",
          "basis": "interpretive_objective_not_new_normative_rule"
        }
      ],
      "semantic_role": "goal",
      "atomicity": "single_intent_candidate"
    },
    {
      "id": "INTENT-0042",
      "via_rules": [
        {
          "id": "NOM-0065",
          "basis": "interpretive_objective_not_new_normative_rule"
        },
        {
          "id": "NOM-0067",
          "basis": "interpretive_objective_not_new_normative_rule"
        }
      ],
      "semantic_role": "goal",
      "atomicity": "single_intent_candidate"
    },
    {
      "id": "INTENT-0044",
      "via_rules": [
        {
          "id": "NOM-0074",
          "basis": "interpretive_objective_not_new_normative_rule"
        },
        {
          "id": "NOM-0075",
          "basis": "interpretive_objective_not_new_normative_rule"
        },
        {
          "id": "NOM-0111",
          "basis": "interpretive_objective_not_new_normative_rule"
        },
        {
          "id": "NOM-0113",
          "basis": "interpretive_objective_not_new_normative_rule"
        }
      ],
      "semantic_role": "goal",
      "atomicity": "single_intent_candidate"
    },
    {
      "id": "INTENT-0045",
      "via_rules": [
        {
          "id": "NOM-0074",
          "basis": "interpretive_objective_not_new_normative_rule"
        },
        {
          "id": "NOM-0076",
          "basis": "interpretive_objective_not_new_normative_rule"
        }
      ],
      "semantic_role": "goal",
      "atomicity": "single_intent_candidate"
    },
    {
      "id": "INTENT-0050",
      "via_rules": [
        {
          "id": "NOM-0075",
          "basis": "interpretive_objective_not_new_normative_rule"
        }
      ],
      "semantic_role": "goal",
      "atomicity": "single_intent_candidate"
    },
    {